title,body,category_id
"10 Tips for Effective Home Workouts","Staying fit at home can be challenging, but with the right strategies, it can be both effective and enjoyable. Here are ten tips to enhance your home workout experience: Start with a warm-up, set specific goals, create a dedicated workout space, and consider using online resources for guidance.",1
"The Benefits of a Balanced Diet","Eating a balanced diet is crucial for maintaining good health. It helps to provide the body with essential nutrients, supports growth and development, and reduces the risk of chronic diseases. A balanced diet typically includes a variety of fruits, vegetables, whole grains, and lean proteins.",2
"How to Stay Motivated During Your Fitness Journey","Staying motivated can often be the hardest part of any fitness journey. To keep your spirits high, try setting achievable short-term goals, tracking your progress, and surrounding yourself with supportive friends or family who encourage your efforts.",3
"A Beginner's Guide to Yoga","Yoga is a fantastic way to improve flexibility, strength, and mental clarity. For beginners, it can be helpful to start with basic poses like Downward Dog, Cat-Cow, and Child’s Pose. Remember to focus on your breath and listen to your body throughout your practice.",4
"The Importance of Rest and Recovery","Many people underestimate the importance of rest in their fitness regimen. Recovery is essential for muscle growth, injury prevention, and overall performance. Aim for at least one rest day per week, and consider incorporating activities like stretching or light walking.",5
"Exploring Different Types of Workouts: Which is Right for You?","There are many types of workouts available, each with its benefits. From weightlifting to cardio to yoga, finding the right fit for your lifestyle and fitness goals is essential. Try different classes or activities to see what you enjoy most.",6
"Healthy Snacks to Fuel Your Workouts","Nutrition plays a vital role in your workout performance. Choosing healthy snacks like fruits, nuts, or protein bars can provide the energy you need to power through your workouts. Remember to fuel your body adequately before and after exercise.",7
"How to Set Realistic Fitness Goals","Setting realistic fitness goals is key to staying motivated and achieving success. Start with small, achievable objectives and gradually work your way up. Remember to celebrate your accomplishments along the way to keep your motivation high.",8
"The Science Behind Strength Training","Strength training is not just about building muscle; it also plays a crucial role in improving overall health. It can boost metabolism, enhance bone density, and improve joint stability. Incorporating strength training into your routine can lead to long-term health benefits.",9
